======================================================================
FIRE-WEIGHT PARAMETER SWEEP (PARALLEL)
======================================================================
Fire-weight values: 20 points from 0.0 to 5.0
Trials per value: 200
Firefighters: 2
Max ticks: 400 (~80 seconds)
Total benchmarks: 20 x 200 = 4000 trials
Parallel workers: 15
======================================================================

[22:32:00] Starting fire-weight = 1.05
[22:34:02] FAILED fire-weight=1.05 (121.6s)
Traceback (most recent call last):
  File "/Users/skyliu/HiMCM2025/benchmark_mall_fast.py", line 385, in <module>
    main()
  File "/Users/skyliu/HiMCM2025/benchmark_mall_fast.py", line 365, in main
    results = benchmark_mall_fast(
  File "/Users/skyliu/HiMCM2025/benchmark_mall_fast.py", line 235, in benchmark_mall_fast
    result = run_single_trial(
  File "/Users/skyliu/HiMCM2025/benchmark_mall_fast.py", line 103, in run_single_trial
    actions = model.get_actions(state)
  File "/Users/skyliu/HiMCM2025/optimal_rescue_model.py", line 89, in get_actions
    self._handle_replanning(state)
  File "/Users/skyliu/HiMCM2025/optimal_rescue_model.py", line 410, in _handle_replanning
    affected_count = self.coordinator.handle_graph_change(state, self.optimizer)
  File "/Users/skyliu/HiMCM2025/tactical_coordinator.py", line 468, in handle_graph_change
    current_plan.truncate_to_unaltered(
  File "/Users/skyliu/HiMCM2025/tactical_coordinator.py", line 138, in truncate_to_unaltered
    current = self.entry_exit if self.current_path_idx == 0 else self.full_path[self.current_path_idx]
IndexError: list index out of range

[22:32:00] Starting fire-weight = 3.42
[22:33:08] FAILED fire-weight=3.42 (68.0s)
Traceback (most recent call last):
  File "/Users/skyliu/HiMCM2025/benchmark_mall_fast.py", line 385, in <module>
    main()
  File "/Users/skyliu/HiMCM2025/benchmark_mall_fast.py", line 365, in main
    results = benchmark_mall_fast(
  File "/Users/skyliu/HiMCM2025/benchmark_mall_fast.py", line 235, in benchmark_mall_fast
    result = run_single_trial(
  File "/Users/skyliu/HiMCM2025/benchmark_mall_fast.py", line 103, in run_single_trial
    actions = model.get_actions(state)
  File "/Users/skyliu/HiMCM2025/optimal_rescue_model.py", line 89, in get_actions
    self._handle_replanning(state)
  File "/Users/skyliu/HiMCM2025/optimal_rescue_model.py", line 410, in _handle_replanning
    affected_count = self.coordinator.handle_graph_change(state, self.optimizer)
  File "/Users/skyliu/HiMCM2025/tactical_coordinator.py", line 468, in handle_graph_change
    current_plan.truncate_to_unaltered(
  File "/Users/skyliu/HiMCM2025/tactical_coordinator.py", line 138, in truncate_to_unaltered
    current = self.entry_exit if self.current_path_idx == 0 else self.full_path[self.current_path_idx]
IndexError: list index out of range

[22:33:08] Starting fire-weight = 4.21
[22:34:18] FAILED fire-weight=4.21 (69.6s)
Traceback (most recent call last):
  File "/Users/skyliu/HiMCM2025/benchmark_mall_fast.py", line 385, in <module>
    main()
  File "/Users/skyliu/HiMCM2025/benchmark_mall_fast.py", line 365, in main
    results = benchmark_mall_fast(
  File "/Users/skyliu/HiMCM2025/benchmark_mall_fast.py", line 235, in benchmark_mall_fast
    result = run_single_trial(
  File "/Users/skyliu/HiMCM2025/benchmark_mall_fast.py", line 103, in run_single_trial
    actions = model.get_actions(state)
  File "/Users/skyliu/HiMCM2025/optimal_rescue_model.py", line 89, in get_actions
    self._handle_replanning(state)
  File "/Users/skyliu/HiMCM2025/optimal_rescue_model.py", line 410, in _handle_replanning
    affected_count = self.coordinator.handle_graph_change(state, self.optimizer)
  File "/Users/skyliu/HiMCM2025/tactical_coordinator.py", line 468, in handle_graph_change
    current_plan.truncate_to_unaltered(
  File "/Users/skyliu/HiMCM2025/tactical_coordinator.py", line 138, in truncate_to_unaltered
    current = self.entry_exit if self.current_path_idx == 0 else self.full_path[self.current_path_idx]
IndexError: list index out of range

[22:32:00] Starting fire-weight = 3.68
[22:33:11] FAILED fire-weight=3.68 (70.4s)
Traceback (most recent call last):
  File "/Users/skyliu/HiMCM2025/benchmark_mall_fast.py", line 385, in <module>
    main()
  File "/Users/skyliu/HiMCM2025/benchmark_mall_fast.py", line 365, in main
    results = benchmark_mall_fast(
  File "/Users/skyliu/HiMCM2025/benchmark_mall_fast.py", line 235, in benchmark_mall_fast
    result = run_single_trial(
  File "/Users/skyliu/HiMCM2025/benchmark_mall_fast.py", line 103, in run_single_trial
    actions = model.get_actions(state)
  File "/Users/skyliu/HiMCM2025/optimal_rescue_model.py", line 89, in get_actions
    self._handle_replanning(state)
  File "/Users/skyliu/HiMCM2025/optimal_rescue_model.py", line 410, in _handle_replanning
    affected_count = self.coordinator.handle_graph_change(state, self.optimizer)
  File "/Users/skyliu/HiMCM2025/tactical_coordinator.py", line 468, in handle_graph_change
    current_plan.truncate_to_unaltered(
  File "/Users/skyliu/HiMCM2025/tactical_coordinator.py", line 138, in truncate_to_unaltered
    current = self.entry_exit if self.current_path_idx == 0 else self.full_path[self.current_path_idx]
IndexError: list index out of range

[22:33:11] Starting fire-weight = 4.47
[22:34:21] FAILED fire-weight=4.47 (70.7s)
Traceback (most recent call last):
  File "/Users/skyliu/HiMCM2025/benchmark_mall_fast.py", line 385, in <module>
    main()
  File "/Users/skyliu/HiMCM2025/benchmark_mall_fast.py", line 365, in main
    results = benchmark_mall_fast(
  File "/Users/skyliu/HiMCM2025/benchmark_mall_fast.py", line 235, in benchmark_mall_fast
    result = run_single_trial(
  File "/Users/skyliu/HiMCM2025/benchmark_mall_fast.py", line 103, in run_single_trial
    actions = model.get_actions(state)
  File "/Users/skyliu/HiMCM2025/optimal_rescue_model.py", line 89, in get_actions
    self._handle_replanning(state)
  File "/Users/skyliu/HiMCM2025/optimal_rescue_model.py", line 410, in _handle_replanning
    affected_count = self.coordinator.handle_graph_change(state, self.optimizer)
  File "/Users/skyliu/HiMCM2025/tactical_coordinator.py", line 468, in handle_graph_change
    current_plan.truncate_to_unaltered(
  File "/Users/skyliu/HiMCM2025/tactical_coordinator.py", line 138, in truncate_to_unaltered
    current = self.entry_exit if self.current_path_idx == 0 else self.full_path[self.current_path_idx]
IndexError: list index out of range

[22:32:00] Starting fire-weight = 0.00
[22:32:14] FAILED fire-weight=0.00 (14.0s)
Traceback (most recent call last):
  File "/Users/skyliu/HiMCM2025/benchmark_mall_fast.py", line 385, in <module>
    main()
  File "/Users/skyliu/HiMCM2025/benchmark_mall_fast.py", line 365, in main
    results = benchmark_mall_fast(
  File "/Users/skyliu/HiMCM2025/benchmark_mall_fast.py", line 235, in benchmark_mall_fast
    result = run_single_trial(
  File "/Users/skyliu/HiMCM2025/benchmark_mall_fast.py", line 103, in run_single_trial
    actions = model.get_actions(state)
  File "/Users/skyliu/HiMCM2025/optimal_rescue_model.py", line 89, in get_actions
    self._handle_replanning(state)
  File "/Users/skyliu/HiMCM2025/optimal_rescue_model.py", line 410, in _handle_replanning
    affected_count = self.coordinator.handle_graph_change(state, self.optimizer)
  File "/Users/skyliu/HiMCM2025/tactical_coordinator.py", line 468, in handle_graph_change
    current_plan.truncate_to_unaltered(
  File "/Users/skyliu/HiMCM2025/tactical_coordinator.py", line 138, in truncate_to_unaltered
    current = self.entry_exit if self.current_path_idx == 0 else self.full_path[self.current_path_idx]
IndexError: list index out of range

[22:32:14] Starting fire-weight = 3.95
[22:33:22] FAILED fire-weight=3.95 (68.1s)
Traceback (most recent call last):
  File "/Users/skyliu/HiMCM2025/benchmark_mall_fast.py", line 385, in <module>
    main()
  File "/Users/skyliu/HiMCM2025/benchmark_mall_fast.py", line 365, in main
    results = benchmark_mall_fast(
  File "/Users/skyliu/HiMCM2025/benchmark_mall_fast.py", line 235, in benchmark_mall_fast
    result = run_single_trial(
  File "/Users/skyliu/HiMCM2025/benchmark_mall_fast.py", line 103, in run_single_trial
    actions = model.get_actions(state)
  File "/Users/skyliu/HiMCM2025/optimal_rescue_model.py", line 89, in get_actions
    self._handle_replanning(state)
  File "/Users/skyliu/HiMCM2025/optimal_rescue_model.py", line 410, in _handle_replanning
    affected_count = self.coordinator.handle_graph_change(state, self.optimizer)
  File "/Users/skyliu/HiMCM2025/tactical_coordinator.py", line 468, in handle_graph_change
    current_plan.truncate_to_unaltered(
  File "/Users/skyliu/HiMCM2025/tactical_coordinator.py", line 138, in truncate_to_unaltered
    current = self.entry_exit if self.current_path_idx == 0 else self.full_path[self.current_path_idx]
IndexError: list index out of range

[22:33:22] Starting fire-weight = 4.74
[22:34:32] FAILED fire-weight=4.74 (69.7s)
Traceback (most recent call last):
  File "/Users/skyliu/HiMCM2025/benchmark_mall_fast.py", line 385, in <module>
    main()
  File "/Users/skyliu/HiMCM2025/benchmark_mall_fast.py", line 365, in main
    results = benchmark_mall_fast(
  File "/Users/skyliu/HiMCM2025/benchmark_mall_fast.py", line 235, in benchmark_mall_fast
    result = run_single_trial(
  File "/Users/skyliu/HiMCM2025/benchmark_mall_fast.py", line 103, in run_single_trial
    actions = model.get_actions(state)
  File "/Users/skyliu/HiMCM2025/optimal_rescue_model.py", line 89, in get_actions
    self._handle_replanning(state)
  File "/Users/skyliu/HiMCM2025/optimal_rescue_model.py", line 410, in _handle_replanning
    affected_count = self.coordinator.handle_graph_change(state, self.optimizer)
  File "/Users/skyliu/HiMCM2025/tactical_coordinator.py", line 468, in handle_graph_change
    current_plan.truncate_to_unaltered(
  File "/Users/skyliu/HiMCM2025/tactical_coordinator.py", line 138, in truncate_to_unaltered
    current = self.entry_exit if self.current_path_idx == 0 else self.full_path[self.current_path_idx]
IndexError: list index out of range

[22:32:00] Starting fire-weight = 0.79
[22:34:01] FAILED fire-weight=0.79 (121.2s)
Traceback (most recent call last):
  File "/Users/skyliu/HiMCM2025/benchmark_mall_fast.py", line 385, in <module>
    main()
  File "/Users/skyliu/HiMCM2025/benchmark_mall_fast.py", line 365, in main
    results = benchmark_mall_fast(
  File "/Users/skyliu/HiMCM2025/benchmark_mall_fast.py", line 235, in benchmark_mall_fast
    result = run_single_trial(
  File "/Users/skyliu/HiMCM2025/benchmark_mall_fast.py", line 103, in run_single_trial
    actions = model.get_actions(state)
  File "/Users/skyliu/HiMCM2025/optimal_rescue_model.py", line 89, in get_actions
    self._handle_replanning(state)
  File "/Users/skyliu/HiMCM2025/optimal_rescue_model.py", line 410, in _handle_replanning
    affected_count = self.coordinator.handle_graph_change(state, self.optimizer)
  File "/Users/skyliu/HiMCM2025/tactical_coordinator.py", line 468, in handle_graph_change
    current_plan.truncate_to_unaltered(
  File "/Users/skyliu/HiMCM2025/tactical_coordinator.py", line 138, in truncate_to_unaltered
    current = self.entry_exit if self.current_path_idx == 0 else self.full_path[self.current_path_idx]
IndexError: list index out of range

[22:34:01] Starting fire-weight = 5.00
[22:35:10] FAILED fire-weight=5.00 (68.3s)
Traceback (most recent call last):
  File "/Users/skyliu/HiMCM2025/benchmark_mall_fast.py", line 385, in <module>
    main()
  File "/Users/skyliu/HiMCM2025/benchmark_mall_fast.py", line 365, in main
    results = benchmark_mall_fast(
  File "/Users/skyliu/HiMCM2025/benchmark_mall_fast.py", line 235, in benchmark_mall_fast
    result = run_single_trial(
  File "/Users/skyliu/HiMCM2025/benchmark_mall_fast.py", line 103, in run_single_trial
    actions = model.get_actions(state)
  File "/Users/skyliu/HiMCM2025/optimal_rescue_model.py", line 89, in get_actions
    self._handle_replanning(state)
  File "/Users/skyliu/HiMCM2025/optimal_rescue_model.py", line 410, in _handle_replanning
    affected_count = self.coordinator.handle_graph_change(state, self.optimizer)
  File "/Users/skyliu/HiMCM2025/tactical_coordinator.py", line 468, in handle_graph_change
    current_plan.truncate_to_unaltered(
  File "/Users/skyliu/HiMCM2025/tactical_coordinator.py", line 138, in truncate_to_unaltered
    current = self.entry_exit if self.current_path_idx == 0 else self.full_path[self.current_path_idx]
IndexError: list index out of range

[22:32:00] Starting fire-weight = 2.37
[22:35:59] DONE fire-weight=2.37: avg=88.5% min=47.2% (238.4s)
[22:32:00] Starting fire-weight = 2.89
[22:36:02] DONE fire-weight=2.89: avg=89.1% min=47.2% (241.8s)
[22:32:00] Starting fire-weight = 3.16
[22:36:02] DONE fire-weight=3.16: avg=88.0% min=47.2% (241.8s)
[22:32:00] Starting fire-weight = 1.84
[22:36:02] DONE fire-weight=1.84: avg=88.5% min=47.2% (242.0s)
[22:32:00] Starting fire-weight = 2.11
[22:36:02] DONE fire-weight=2.11: avg=88.8% min=47.2% (242.2s)
[22:32:00] Starting fire-weight = 0.53
[22:36:03] DONE fire-weight=0.53: avg=87.5% min=47.2% (242.6s)
[22:32:00] Starting fire-weight = 1.58
[22:36:02] DONE fire-weight=1.58: avg=88.4% min=47.2% (242.1s)
[22:32:00] Starting fire-weight = 1.32
[22:36:03] DONE fire-weight=1.32: avg=87.9% min=47.2% (243.2s)
[22:32:00] Starting fire-weight = 2.63
[22:36:04] DONE fire-weight=2.63: avg=88.6% min=47.2% (243.6s)
[22:32:00] Starting fire-weight = 0.26
[22:36:05] DONE fire-weight=0.26: avg=88.4% min=47.2% (244.6s)
Progress: 1/20 fire-weight values completed
Progress: 2/20 fire-weight values completed
Progress: 3/20 fire-weight values completed
Progress: 4/20 fire-weight values completed
Progress: 5/20 fire-weight values completed
Progress: 6/20 fire-weight values completed
Progress: 7/20 fire-weight values completed
Progress: 8/20 fire-weight values completed
Progress: 9/20 fire-weight values completed
Progress: 10/20 fire-weight values completed
Progress: 11/20 fire-weight values completed
Progress: 12/20 fire-weight values completed
Progress: 13/20 fire-weight values completed
Progress: 14/20 fire-weight values completed
Progress: 15/20 fire-weight values completed
Progress: 16/20 fire-weight values completed
Progress: 17/20 fire-weight values completed
Progress: 18/20 fire-weight values completed
Progress: 19/20 fire-weight values completed
Progress: 20/20 fire-weight values completed

======================================================================
All benchmarks completed in 4.1 minutes
======================================================================

======================================================================
Results saved to: fire_weight_sweep_results.json
======================================================================

======================================================================
Plot saved to: fire_weight_sweep.png
======================================================================

======================================================================
SUMMARY TABLE
======================================================================
Fire-Weight  Avg Survival   Min Survival   Std Dev   
----------------------------------------------------------------------
0.26         88.43         % 47.17         % 13.11     %
0.53         87.55         % 47.17         % 13.29     %
1.32         87.86         % 47.17         % 12.89     %
1.58         88.41         % 47.17         % 12.64     %
1.84         88.54         % 47.17         % 12.41     %
2.11         88.77         % 47.17         % 12.49     %
2.37         88.51         % 47.17         % 12.44     %
2.63         88.57         % 47.17         % 12.24     %
2.89         89.09         % 47.17         % 12.00     %
3.16         88.04         % 47.17         % 12.49     %

======================================================================
OPTIMAL FIRE-WEIGHT
======================================================================
Fire-weight: 2.89
Avg survival: 89.09%
Min survival: 47.17%
Max survival: 100.00%
Std dev: 12.00%
======================================================================
======================================================================
COMPLETING FIRE-WEIGHT PARAMETER SWEEP (MISSING VALUES ONLY)
======================================================================
Missing fire-weight values: 9
Values: 0.00, 1.05, 3.42, 3.68, 3.95, 4.21, 4.47, 4.74, 5.00
Trials per value: 200
Firefighters: 2
Parallel workers: 15
======================================================================

[22:39:50] Starting fire-weight = 4.21
[22:42:27] DONE fire-weight=4.21: avg=88.3% min=47.2% (157.0s)
[22:39:50] Starting fire-weight = 3.68
[22:42:27] DONE fire-weight=3.68: avg=88.3% min=47.2% (157.0s)
[22:39:50] Starting fire-weight = 0.00
[22:42:30] DONE fire-weight=0.00: avg=88.6% min=47.2% (159.5s)
[22:39:50] Starting fire-weight = 4.74
[22:42:30] DONE fire-weight=4.74: avg=88.6% min=47.2% (159.6s)
[22:39:50] Starting fire-weight = 1.05
[22:42:31] DONE fire-weight=1.05: avg=87.9% min=47.2% (160.4s)
[22:39:50] Starting fire-weight = 4.47
[22:42:31] DONE fire-weight=4.47: avg=88.9% min=47.2% (161.2s)
[22:39:50] Starting fire-weight = 5.00
[22:42:32] DONE fire-weight=5.00: avg=88.8% min=47.2% (161.4s)
[22:39:50] Starting fire-weight = 3.95
[22:42:32] DONE fire-weight=3.95: avg=88.1% min=47.2% (162.0s)
[22:39:50] Starting fire-weight = 3.42
[22:42:33] DONE fire-weight=3.42: avg=88.4% min=47.2% (162.6s)
Progress: 1/9 missing fire-weight values completed
Progress: 2/9 missing fire-weight values completed
Progress: 3/9 missing fire-weight values completed
Progress: 4/9 missing fire-weight values completed
Progress: 5/9 missing fire-weight values completed
Progress: 6/9 missing fire-weight values completed
Progress: 7/9 missing fire-weight values completed
Progress: 8/9 missing fire-weight values completed
Progress: 9/9 missing fire-weight values completed

======================================================================
Missing benchmarks completed in 2.7 minutes
Successfully completed: 9/9
======================================================================
